series_id,name,description
NY.ADJ.NNAT.GN.ZS,Adjusted savings: net national savings (% of GNI),Net national savings are equal to gross national savings less the value of consumption of fixed capital. This indicator is expressed as a percentage of Gross National Income (GNI) which is the total income earned by all residents within an economic territory during an accounting period. It is equal to gross domestic product plus earned income receivable from abroad minus earned income payable abroad.
NY.GNP.PCAP.PP.KD,"GNI per capita, PPP (constant 2021 international $)","This indicator provides values for gross national income (GNI) per person expressed in constant international dollars, converted by purchasing power parities (PPPs). PPPs account for the different price levels across countries and thus PPP-based comparisons of economic output are more appropriate for comparing the output of economies and the average material well-being of their inhabitants than exchange-rate based comparisons. 
Gross national income is the total income earned by all residents within an economic territory during an accounting period. It is equal to gross domestic product plus earned income receivable from abroad minus earned income payable abroad. The core indicator has been divided by the general population to achieve a per capita estimate. This indicator is expressed in constant prices, meaning the series has been adjusted to account for price changes over time. The reference year for this adjustment is 2021. The PPP conversion factor is a currency conversion factor and a spatial price deflator. PPPs convert different currencies to a common currency and, in the process of conversion, equalize their purchasing power by eliminating the differences in price levels between countries, thereby allowing volume or output comparisons of GDP and its expenditure components."
NY.GDP.MKTP.PP.CD,"GDP, PPP (current international $)","This indicator provides values for gross domestic product (GDP) expressed in current international dollars, converted by purchasing power parities (PPPs). PPPs account for the different price levels across countries and thus PPP-based comparisons of economic output are more appropriate for comparing the output of economies and the average material well-being of their inhabitants than exchange-rate based comparisons.  
Gross domestic product is the total income earned through the production of goods and services in an economic territory during an accounting period. It can be measured in three different ways: using either the expenditure approach, the income approach, or the production approach. This series has been linked to produce a consistent time series to counteract breaks in series over time due to changes in base years, source data and methodologies. Thus, it may not be comparable with other national accounts series in the database for historical years. This indicator is expressed in current prices, meaning no adjustment has been made to account for price changes over time. The PPP conversion factor is a currency conversion factor and a spatial price deflator. PPPs convert different currencies to a common currency and, in the process of conversion, equalize their purchasing power by eliminating the differences in price levels between countries, thereby allowing volume or output comparisons of GDP and its expenditure components."
CM.MKT.TRAD.CD,"Stocks traded, total value (current US$)","The value of shares traded is the total number of shares traded, both domestic and foreign, multiplied by their respective matching prices. Figures are single counted (only one side of the transaction is considered). Companies admitted to listing and admitted to trading are included in the data. Data are end of year values converted to U.S. dollars using corresponding year-end foreign exchange rates."
FP.CPI.TOTL,Consumer price index (2010 = 100),"Index of the prices of consumption goods and services, as compared to a certain reference period (2010=100)."
GC.REV.XGRT.GD.ZS,"Revenue, excluding grants (% of GDP)",Revenue is an increase in net worth resulting from a transaction. Grants are excluded from this figure. This indicator is expressed as a percentage of Gross Domestic Product (GDP) which is the total income earned through the production of goods and services in an economic territory during an accounting period.
TM.VAL.MRCH.CD.WT,Merchandise imports (current US$),"Merchandise imports includes goods whose economic ownership is changed from a non-resident to a resident and that are not included in the following specific categories: goods under merchanting, non-monetary gold, and parts of travel, construction, and government goods and services n.i.e. This indicator is expressed in current prices, meaning no adjustment has been made to account for price changes over time. This indicator is expressed in United States dollars."
GC.DOD.TOTL.CN,"Central government debt, total (current LCU)","Debt is the entire stock of direct government fixed-term contractual obligations to others outstanding on a particular date. It includes domestic and foreign liabilities such as currency and money deposits, securities other than shares, and loans. It is the gross amount of government liabilities reduced by the amount of equity and financial derivatives held by the government. Because debt is a stock rather than a flow, it is measured as of a given date, usually the last day of the fiscal year. Central government is the part of general government that includes all administrative departments of the national executive, legislative, and judicial functions, other central agencies and those non-market producers controlled by the central government, whose competence extends normally over the whole economic territory. This indicator is expressed in current prices, meaning no adjustment has been made to account for price changes over time. This series is expressed in local currency units."
GC.XPN.TOTL.GD.ZS,Expense (% of GDP),Expense is a decrease in net worth resulting from a transaction. This indicator is expressed as a percentage of Gross Domestic Product (GDP) which is the total income earned through the production of goods and services in an economic territory during an accounting period.
FB.AST.NPER.ZS,Bank nonperforming loans to total gross loans (%),"The indicator measures the proportion of a deposit taker’s loan portfolio that is impaired or at risk of default. It is calculated as the ratio of non-performing loans (NPLs) to total gross loans, where NPLs are defined as loans that are past due by 90 days or more or are otherwise considered unlikely to be repaid in full without the realization of collateral. Both non-performing loans and total gross loans should be reported at their gross book value, without deducting for loan-loss provisions or collateral. This indicator provides a key measure of asset quality and potential credit risk in the banking system."
NY.ADJ.NNTY.KD.ZG,Adjusted net national income (annual % growth),Adjusted net national income is GNI minus consumption of fixed capital and natural resources depletion. This indicator denotes the percentage change over each previous year of the constant price (base year 2015) series in United States dollars.
PA.NUS.ATLS,DEC alternative conversion factor (LCU per US$),"The DEC alternative conversion factor is the underlying annual exchange rate (the price of one country’s currency in relation to another country's currency) used for the World Bank Atlas method. As a rule, it is the official exchange rate reported in the IMF's International Financial Statistics. Exceptions arise where further refinements are made by World Bank staff. It is expressed in local currency units per U.S. dollar."
NY.GDP.DEFL.KD.ZG,"Inflation, GDP deflator (annual %)",Inflation as measured by the annual growth rate of the GDP implicit deflator shows the rate of price change in the economy as a whole. The GDP implicit deflator is the ratio of GDP in current local currency to GDP in constant local currency.
NE.GDI.STKB.CD,Changes in inventories (current US$),"Changes in inventories is the value of entries into inventories less the value of withdrawals and less the value of any recurrent losses of goods held in inventories during the accounting period.This indicator is expressed in current prices, meaning no adjustment has been made to account for price changes over time. This indicator is expressed in United States dollars."
GC.DOD.TOTL.GD.ZS,"Central government debt, total (% of GDP)","Debt is the entire stock of direct government fixed-term contractual obligations to others outstanding on a particular date. It includes domestic and foreign liabilities such as currency and money deposits, securities other than shares, and loans. It is the gross amount of government liabilities reduced by the amount of equity and financial derivatives held by the government. Because debt is a stock rather than a flow, it is measured as of a given date, usually the last day of the fiscal year. Central government is the part of general government that includes all administrative departments of the national executive, legislative, and judicial functions, other central agencies and those non-market producers controlled by the central government, whose competence extends normally over the whole economic territory. This indicator is expressed as a percentage of Gross Domestic Product (GDP) which is the total income earned through the production of goods and services in an economic territory during an accounting period."
NY.GDP.MKTP.PP.KD,"GDP, PPP (constant 2021 international $)","This indicator provides values for gross domestic product (GDP) expressed in constant international dollars, converted by purchasing power parities (PPPs). PPPs account for the different price levels across countries and thus PPP-based comparisons of economic output are more appropriate for comparing the output of economies and the average material well-being of their inhabitants than exchange-rate based comparisons. 
Gross domestic product is the total income earned through the production of goods and services in an economic territory during an accounting period. It can be measured in three different ways: using either the expenditure approach, the income approach, or the production approach. This indicator is expressed in constant prices, meaning the series has been adjusted to account for price changes over time. The reference year for this adjustment is 2021. The PPP conversion factor is a currency conversion factor and a spatial price deflator. PPPs convert different currencies to a common currency and, in the process of conversion, equalize their purchasing power by eliminating the differences in price levels between countries, thereby allowing volume or output comparisons of GDP and its expenditure components."
BN.CAB.XOKA.GD.ZS,Current account balance (% of GDP),"Balance of current transactions (transactions in goods and services, earned income and transfer income) between residents and non-residents. The term current account balance is used in the external accounts and is expressed from the perspective of resident units. The term current external balance is used in the national accounts and is expressed from the perspective of the non-resident units, and therefore with the opposite sign. This indicator is expressed as a percentage of Gross Domestic Product (GDP) which is the total income earned through the production of goods and services in an economic territory during an accounting period."
NE.EXP.GNFS.KD,Exports of goods and services (constant 2015 US$),"Exports of goods includes changes in the economic ownership of goods from residents of the compiling economy to non-residents, irrespective of physical movement of goods across national borders. Exports of services includes services provided by residents to non-residents. This indicator is expressed in constant prices, meaning the series has been adjusted to account for price changes over time. The reference year for this adjustment is 2015. This indicator is expressed in United States dollars."
NE.RSB.GNFS.CD,External balance on goods and services (current US$),"The balance of international trade in goods and services is the difference between the exports and imports of goods and services. This indicator is expressed in current prices, meaning no adjustment has been made to account for price changes over time. This indicator is expressed in United States dollars."
NE.EXP.GNFS.CD,Exports of goods and services (current US$),"Exports of goods includes changes in the economic ownership of goods from residents of the compiling economy to non-residents, irrespective of physical movement of goods across national borders. Exports of services includes services provided by residents to non-residents. This indicator is expressed in current prices, meaning no adjustment has been made to account for price changes over time. This indicator is expressed in United States dollars."
CM.MKT.TRAD.GD.ZS,"Stocks traded, total value (% of GDP)","The value of shares traded is the total number of shares traded, both domestic and foreign, multiplied by their respective matching prices. Figures are single counted (only one side of the transaction is considered). Companies admitted to listing and admitted to trading are included in the data. Data are end of year values."
FS.AST.PRVT.GD.ZS,Domestic credit to private sector (% of GDP),"Domestic credit to private sector refers to financial resources provided to the private sector by financial corporations, such as through loans, purchases of nonequity securities, and trade credits and other accounts receivable, that establish a claim for repayment. For some countries these claims include credit to public enterprises. The financial corporations include monetary authorities and deposit money banks, as well as other financial corporations where data are available (including corporations that do not accept transferable deposits but do incur such liabilities as time and savings deposits). Examples of other financial corporations are finance and leasing companies, money lenders, insurance corporations, pension funds, and foreign exchange companies. This indicator is expressed as a percentage of Gross Domestic Product (GDP) which is the total income earned through the production of goods and services in an economic territory during an accounting period."
DT.DOD.DECT.CD,"External debt stocks, total (DOD, current US$)","Total external debt is debt owed to nonresidents repayable in currency, goods, or services. Total external debt is the sum of public, publicly guaranteed, and private nonguaranteed long-term debt, use of IMF credit, and short-term debt. Short-term debt includes all debt having an original maturity of one year or less and interest in arrears on long-term debt. Data are in current U.S. dollars."
FM.LBL.BMNY.CN,Broad money (current LCU),"Broad money is the sum of all liquid financial instruments held by money-holding sectors that are widely accepted in an economy as a medium of exchange, plus those that can be converted into a medium of exchange at short notice at, or close to, their full nominal value. This indicator is expressed in current prices, meaning no adjustment has been made to account for price changes over time. This series is expressed in local currency units."
FM.LBL.BMNY.ZG,Broad money growth (annual %),"Broad money is the sum of all liquid financial instruments held by money-holding sectors that are widely accepted in an economy as a medium of exchange, plus those that can be converted into a medium of exchange at short notice at, or close to, their full nominal value. This indicator denotes the percentage change over each previous year of the constant price (base year 2015) series in United States dollars."
NE.IMP.GNFS.CD,Imports of goods and services (current US$),"Imports of goods includes change in the economic ownership of goods from non-residents to
residents of the compiling economy, irrespective of physical movement of goods across national borders. Imports of services includes services provided by non-residents to residents. This indicator is expressed in current prices, meaning no adjustment has been made to account for price changes over time. This indicator is expressed in United States dollars."
CM.MKT.LCAP.CD,Market capitalization of listed domestic companies (current US$),"Market capitalization (also known as market value) is the share price times the number of shares outstanding (including their several classes) for listed domestic companies. Investment funds, unit trusts, and companies whose only business goal is to hold shares of other listed companies are excluded. Data are end of year values converted to U.S. dollars using corresponding year-end foreign exchange rates."
NE.CON.PRVT.KD.ZG,Households and NPISHs Final consumption expenditure (annual % growth),"This field includes expenditure on goods and services by the Household and NPISH sector for the direct satisfaction of human needs or wants, whether individual or collective. This indicator denotes the percentage change over each previous year of the constant price (base year 2015) series in United States dollars."
NE.GDI.TOTL.CD,Gross capital formation (current US$),"Gross capital formation includes acquisitions less disposals of produced assets for purposes of fixed capital formation, inventories or valuables. This indicator is expressed in current prices, meaning no adjustment has been made to account for price changes over time. This indicator is expressed in United States dollars."
CM.MKT.TRNR,"Stocks traded, turnover ratio of domestic shares (%)",Turnover ratio is the value of domestic shares traded divided by their market capitalization. The value is annualized by multiplying the monthly average by 12.
NE.CON.PRVT.CD,Households and NPISHs Final consumption expenditure (current US$),"This field includes expenditure on goods and services by the Household and NPISH sector for the direct satisfaction of human needs or wants, whether individual or collective. This indicator is expressed in current prices, meaning no adjustment has been made to account for price changes over time. This indicator is expressed in United States dollars."
PX.REX.REER,Real effective exchange rate index (2010 = 100),Real effective exchange rate is the nominal effective exchange rate (a measure of the value of a currency against a weighted average of several foreign currencies) divided by a price deflator or index of costs. This indicator is an index series where 2010=100.
NY.GNP.MKTP.CD,GNI (current US$),"Gross national income is the total income earned by all residents within an economic territory during an accounting period. It is equal to gross domestic product plus earned income receivable from abroad minus earned income payable abroad. This indicator is expressed in current prices, meaning no adjustment has been made to account for price changes over time. This indicator is expressed in United States dollars."
NY.GDP.MKTP.KD,GDP (constant 2015 US$),"Gross domestic product is the total income earned through the production of goods and services in an economic territory during an accounting period. It can be measured in three different ways: using either the expenditure approach, the income approach, or the production approach. This indicator is expressed in constant prices, meaning the series has been adjusted to account for price changes over time. The reference year for this adjustment is 2015. This indicator is expressed in United States dollars."
NV.AGR.TOTL.ZS,"Agriculture, forestry, and fishing, value added (% of GDP)","Agriculture, forestry, and fishing corresponds to ISIC (Rev. 4) divisions 01-03 and includes the exploitation of vegetal and animal natural resources, comprising the activities of growing of crops, raising and breeding of animals, harvesting of timber and other plants, animals or animal products from a farm or their natural habitats.Value added is the contribution to the economy by a producer or an industry or an institutional sector, which is estimated by the total value of output produced and deducting the total value of intermediate consumption of goods and services used to produce that output. This indicator is expressed as a percentage of Gross Domestic Product (GDP) which is the total income earned through the production of goods and services in an economic territory during an accounting period. Note: For VAB countries, gross value added at factor cost is used as the denominator."
NY.GDP.MKTP.KD.ZG,GDP growth (annual %),"Gross domestic product is the total income earned through the production of goods and services in an economic territory during an accounting period. It can be measured in three different ways: using either the expenditure approach, the income approach, or the production approach. This indicator denotes the percentage change over each previous year of the constant price (base year 2015) series in United States dollars."
NV.SRV.TOTL.ZS,"Services, value added (% of GDP)","Services industries correspond to ISIC (Rev. 4) divisions 45-99 and includes wholesale and retail trade, repair of motor vehicles, hotels and retaurants, transport, storage and communication, financial intermediation, real estate, renting and business activities, public administration and defence, compulsory social security, education, health and social work, other community, social and personal service activities, private households with employed persons, and extra-territorial organizations and bodies. Value added is the contribution to the economy by a producer or an industry or an institutional sector, which is estimated by the total value of output produced and deducting the total value of intermediate consumption of goods and services used to produce that output. This indicator is expressed as a percentage of Gross Domestic Product (GDP) which is the total income earned through the production of goods and services in an economic territory during an accounting period."
FR.INR.RINR,Real interest rate (%),"An interest rate is the amount charged, expressed as a percentage of the principal over a period of time, by the owners of certain kinds of financial assets for putting the financial assets at the disposal of another institutional unit. The real interest rate is the lending interest rate adjusted for inflation as measured by the GDP deflator. The terms and conditions attached to lending rates differ by country, however, limiting their comparability. This indicator is expressed as a percentage (a÷b)*100."
NY.GDP.PCAP.KD,GDP per capita (constant 2015 US$),"Gross domestic product is the total income earned through the production of goods and services in an economic territory during an accounting period. It can be measured in three different ways: using either the expenditure approach, the income approach, or the production approach. The core indicator has been divided by the general population to achieve a per capita estimate.This indicator is expressed in constant prices, meaning the series has been adjusted to account for price changes over time. The reference year for this adjustment is 2015. This indicator is expressed in United States dollars."
NE.IMP.GNFS.KD.ZG,Imports of goods and services (annual % growth),"Imports of goods includes change in the economic ownership of goods from non-residents to
residents of the compiling economy, irrespective of physical movement of goods across national borders. Imports of services includes services provided by non-residents to residents. This indicator denotes the percentage change over each previous year of the constant price (base year 2015) series in United States dollars."
PA.NUS.PRVT.PP,"PPP conversion factor, private consumption (LCU per international $)","The purchasing power parity (PPP) conversion factor is a currency conversion factor and a spatial price deflator. They convert different currencies to a common currency and, in the process of conversion, equalize their purchasing power by eliminating the differences in price levels between countries, thereby allowing volume or output comparisons of gross domestic product (GDP) and its expenditure components. This conversion factor is for household final consumption expenditure and the base currency is the US dollar."
NV.IND.TOTL.ZS,"Industry (including construction), value added (% of GDP)","Industry (including construction) corresponds to ISIC (Rev.4) divisions 05-43. It is comprised of mining, manufacturing, construction, electricity, water, and gas industries. Value added is the contribution to the economy by a producer or an industry or an institutional sector, which is estimated by the total value of output produced and deducting the total value of intermediate consumption of goods and services used to produce that output. This indicator is expressed as a percentage of Gross Domestic Product (GDP) which is the total income earned through the production of goods and services in an economic territory during an accounting period."
NV.IND.MANF.ZS,"Manufacturing, value added (% of GDP)","Manufacturing includes industries classified in ISIC (Rev. 3) major division C and is defined as the physical or chemical tranformation of materials or components into new products. Value added is the contribution to the economy by a producer or an industry or an institutional sector, which is estimated by the total value of output produced and deducting the total value of intermediate consumption of goods and services used to produce that output. This indicator is expressed as a percentage of Gross Domestic Product (GDP) which is the total income earned through the production of goods and services in an economic territory during an accounting period."
