series_id,name,description
FR.INR.LNDP,"Interest rate spread (lending rate minus deposit rate, %)","Interest rate spread is the interest rate charged by banks on loans to private sector customers minus the interest rate paid by commercial or similar banks for demand, time, or savings deposits. The terms and conditions attached to these rates differ by country, however, limiting their comparability. This indicator is expressed as a percentage (a÷b)*100."
NE.CON.TOTL.CD,Final consumption expenditure (current US$),"Final consumption expenditure is expenditure on goods and services by resident institutional units for the direct satisfaction of human needs or wants, whether individual or collective. Final consumption expenditure can be measured for households, general government, the central bank and non-profit institutions serving households. This indicator is expressed in current prices, meaning no adjustment has been made to account for price changes over time. This indicator is expressed in United States dollars."
PA.NUS.FCRF,"Official exchange rate (LCU per US$, period average)",Official exchange rate refers to the exchange rate determined by national authorities or to the rate determined in the legally sanctioned exchange market. This indicator represents the ratio of Local Currency Units relative to United States dollars.This indicator is derived as an average over the reference period.
BN.RES.INCL.CD,"Reserves and related items (BoP, current US$)","Reserves and related items is the net change in a country's holdings of international reserves resulting from transactions on the current, capital, and financial accounts. Reserve assets are external assets, including monetary gold, that are readily available to and controlled by monetary authorities for meeting balance of payments financing needs, for intervention in exchange markets to affect the currency exchange rate, and for other related purposes (such as maintaining confidence in the currency and the economy, and serving as a basis for foreign borrowing). Reserve assets must be denominated and settled in foreign currency.Also included are net credit and loans from the IMF (excluding reserve position) and total exceptional financing. This indicator is expressed in current prices, meaning no adjustment has been made to account for price changes over time. This indicator is expressed in United States dollars."
FR.INR.LEND,Lending interest rate (%),"Lending rate is the bank rate that usually meets the short- and medium-term financing needs of the private sector. This rate is normally differentiated according to creditworthiness of borrowers and objectives of financing. The terms and conditions attached to these rates differ by country, however, limiting their comparability. This indicator is expressed as a percentage (a÷b)*100."
CM.MKT.LDOM.NO,"Listed domestic companies, total","Listed domestic companies, including foreign companies which are exclusively listed, are those which have shares listed on an exchange at the end of the year. Investment funds, unit trusts, and companies whose only business goal is to hold shares of other listed companies, such as holding companies and investment companies, regardless of their legal status, are excluded. A company with several classes of shares is counted once. Only companies admitted to listing on the exchange are included."
CM.MKT.INDX.ZG,S&P Global Equity Indices (annual % change),S&P Global Equity Indices measure the U.S. dollar price change in the stock markets covered by the S&P BMI country indices.
GC.NLD.TOTL.GD.ZS,Net lending (+) / net borrowing (-) (% of GDP),"Net lending (+) / net borrowing (–) equals government revenue minus expense, minus net investment in nonfinancial assets. It is also equal to the net result of transactions in financial assets and liabilities. Net lending/net borrowing is a summary measure indicating the extent to which government is either putting financial resources at the disposal of other sectors in the economy or abroad, or utilizing the financial resources generated by other sectors in the economy or from abroad. This indicator is expressed as a percentage of Gross Domestic Product (GDP) which is the total income earned through the production of goods and services in an economic territory during an accounting period."
BX.GSR.GNFS.CD,"Exports of goods and services (BoP, current US$)","Exports of goods includes changes in the economic ownership of goods from residents of the compiling economy to non-residents, irrespective of physical movement of goods across national borders. Exports of services includes services provided by residents to non-residents. This indicator is expressed in current prices, meaning no adjustment has been made to account for price changes over time. This indicator is expressed in United States dollars."
NE.EXP.GNFS.ZS,Exports of goods and services (% of GDP),"Exports of goods includes changes in the economic ownership of goods from residents of the compiling economy to non-residents, irrespective of physical movement of goods across national borders. Exports of services includes services provided by residents to non-residents. This indicator is expressed as a percentage of Gross Domestic Product (GDP) which is the total income earned through the production of goods and services in an economic territory during an accounting period."
GC.REV.XGRT.CN,"Revenue, excluding grants (current LCU)","Revenue is an increase in net worth resulting from a transaction. Grants are excluded from this figure. This indicator is expressed in current prices, meaning no adjustment has been made to account for price changes over time. This series is expressed in local currency units."
NE.RSB.GNFS.ZS,External balance on goods and services (% of GDP),The balance of international trade in goods and services is the difference between the exports and imports of goods and services. This indicator is expressed as a percentage of Gross Domestic Product (GDP) which is the total income earned through the production of goods and services in an economic territory during an accounting period.
DT.TDS.DECT.EX.ZS,"Total debt service (% of exports of goods, services and primary income)","Total debt service to exports of goods, services and primary income. Total debt service is the sum of principal repayments and interest actually paid in currency, goods, or services on long-term debt, interest paid on short-term debt, and repayments (repurchases and charges) to the IMF."
FS.AST.DOMS.GD.ZS,Domestic credit provided by financial sector (% of GDP),"Domestic credit provided by the financial sector includes all credit to various sectors on a gross basis, with the exception of credit to the central government, which is net. The financial sector includes monetary authorities and deposit money banks, as well as other financial corporations where data are available (including corporations that do not accept transferable deposits but do incur such liabilities as time and savings deposits). Examples of other financial corporations are finance and leasing companies, money lenders, insurance corporations, pension funds, and foreign exchange companies. This indicator is expressed as a percentage of Gross Domestic Product (GDP) which is the total income earned through the production of goods and services in an economic territory during an accounting period."
PA.NUS.PPP,"PPP conversion factor, GDP (LCU per international $)","The purchasing power parity (PPP) conversion factor is a currency conversion factor and a spatial price deflator. PPPs convert different currencies to a common currency and, in the process of conversion, equalize their purchasing power by eliminating the differences in price levels between countries, thereby allowing volume or output comparisons of gross domestic product (GDP) and its expenditure components. This conversion factor is for the level of GDP and the base currency is the US dollar."
NE.CON.PRVT.ZS,Households and NPISHs final consumption expenditure (% of GDP),"This field includes expenditure on goods and services by the Household and NPISH sector for the direct satisfaction of human needs or wants, whether individual or collective. This indicator is expressed as a percentage of Gross Domestic Product (GDP) which is the total income earned through the production of goods and services in an economic territory during an accounting period."
BX.KLT.DINV.CD.WD,"Foreign direct investment, net inflows (BoP, current US$)","Foreign direct investment refers to direct investment equity flows in the reporting economy. It is the sum of equity capital, reinvestment of earnings, and other capital. Direct investment is a category of cross-border investment associated with a resident in one economy having control or a significant degree of influence on the management of an enterprise that is resident in another economy. Ownership of 10 percent or more of the ordinary shares of voting stock is the criterion for determining the existence of a direct investment relationship. Data are in current U.S. dollars."
SL.UEM.TOTL.ZS,"Unemployment, total (% of total labor force) (modeled ILO estimate)",Unemployment refers to the share of the labor force that is without work but available for and seeking employment.
NY.ADJ.NNTY.PC.CD,Adjusted net national income per capita (current US$),"Adjusted net national income is GNI minus consumption of fixed capital and natural resources depletion. This indicator is expressed in current prices, meaning no adjustment has been made to account for price changes over time.  This indicator is expressed in United States dollars."
FI.RES.TOTL.CD,"Total reserves (includes gold, current US$)","Reserve assets are external assets, including monetary gold, that are readily available to and controlled by monetary authorities for meeting balance of payments financing needs, for intervention in exchange markets to affect the currency exchange rate, and for other related purposes (such as maintaining confidence in the currency and the economy, and serving as a basis for foreign borrowing). Reserve assets must be denominated and settled in foreign currency. This indicator is expressed in current prices, meaning no adjustment has been made to account for price changes over time. This indicator is expressed in United States dollars."
IC.LGL.CRED.XQ,Strength of legal rights index (0=weak to 12=strong),"Strength of legal rights index measures the degree to which collateral and bankruptcy laws protect the rights of borrowers and lenders and thus facilitate lending. The index ranges from 0 to 12, with higher scores indicating that these laws are better designed to expand access to credit."
NY.GDP.DEFL.ZS,GDP deflator (base year varies by country),The GDP implicit deflator is the ratio of GDP in current local currency to GDP in constant local currency. The base year varies by country. This indicator is expressed as a ratio (a÷b).
TX.VAL.TECH.MF.ZS,High-technology exports (% of manufactured exports),"High-technology exports are products with high R&D intensity, such as in aerospace, computers, pharmaceuticals, scientific instruments, and electrical machinery."
TX.VAL.MRCH.CD.WT,Merchandise exports (current US$),"Merchandise exports includes goods whose economic ownership is changed from a resident to a non-resident and that are not included in the following specific categories: goods under merchanting, non-monetary gold, and parts of travel, construction, and government goods and services n.i.e. This indicator is expressed in current prices, meaning no adjustment has been made to account for price changes over time. This indicator is expressed in United States dollars."
TG.VAL.TOTL.GD.ZS,Merchandise trade (% of GDP),"General merchandise trade includes goods whose economic ownership is changed between a resident and a non-resident and that are not included in the following specific categories: goods under merchanting, non-monetary gold, and parts of travel, construction, and government goods and services n.i.e. It is the total of merchandise exports plus merchandise imports. This indicator is expressed as a percentage of Gross Domestic Product (GDP) which is the total income earned through the production of goods and services in an economic territory during an accounting period."
FB.CBK.BRCH.P5,"Commercial bank branches (per 100,000 adults)",Commercial bank branches are retail locations of resident commercial banks and other resident banks that function as commercial banks that provide financial services to customers and are physically separated from the main office but not organized as legally separated subsidiaries.
FB.BNK.CAPA.ZS,Bank capital to assets ratio (%),"The indicator is a measure of capital adequacy that evaluates the financial strength of deposit takers by comparing Tier 1 capital to total assets. Tier 1 capital, often referred to as core capital, includes the most stable and readily available forms of capital, such as common equity, disclosed reserves, retained earnings, and certain other instruments that meet regulatory requirements under the Basel framework. This capital is considered the highest quality because it is fully available to cover losses and does not need to be repaid."
FM.LBL.BMNY.GD.ZS,Broad money (% of GDP),"Broad money is the sum of all liquid financial instruments held by money-holding sectors that are widely accepted in an economy as a medium of exchange, plus those that can be converted into a medium of exchange at short notice at, or close to, their full nominal value. This indicator is expressed as a percentage of Gross Domestic Product (GDP) which is the total income earned through the production of goods and services in an economic territory during an accounting period."
GC.XPN.TOTL.CN,Expense (current LCU),"Expense is a decrease in net worth resulting from a transaction. This indicator is expressed in current prices, meaning no adjustment has been made to account for price changes over time. This series is expressed in local currency units."
GC.TAX.TOTL.CN,Tax revenue (current LCU),"Taxes are compulsory, unrequited payments, in cash or in kind, made by institutional
units to government units. This indicator is expressed in current prices, meaning no adjustment has been made to account for price changes over time. This series is expressed in local currency units."
GC.TAX.TOTL.GD.ZS,Tax revenue (% of GDP),"Taxes are compulsory, unrequited payments, in cash or in kind, made by institutional
units to government units. This indicator is expressed as a percentage of Gross Domestic Product (GDP) which is the total income earned through the production of goods and services in an economic territory during an accounting period."
