series_id,name,description
NE.GDI.TOTL.KD.ZG,Gross capital formation (annual % growth),"Gross capital formation includes acquisitions less disposals of produced assets for purposes of fixed capital formation, inventories or valuables. This indicator denotes the percentage change over each previous year of the constant price (base year 2015) series in United States dollars."
NE.GDI.FTOT.ZS,Gross fixed capital formation (% of GDP),"Gross fixed capital formation includes acquisitions less disposals of fixed assets during the accounting period, including certain specified expenditures on services that add to the value of non-produced assets. This indicator is expressed as a percentage of Gross Domestic Product (GDP) which is the total income earned through the production of goods and services in an economic territory during an accounting period."
NE.GDI.TOTL.KD,Gross capital formation (constant 2015 US$),"Gross capital formation includes acquisitions less disposals of produced assets for purposes of fixed capital formation, inventories or valuables. This indicator is expressed in constant prices, meaning the series has been adjusted to account for price changes over time. The reference year for this adjustment is 2015. This indicator is expressed in United States dollars."
NY.GNP.PCAP.CD,"GNI per capita, Atlas method (current US$)","Gross national income is the total income earned by all residents within an economic territory during an accounting period. It is equal to gross domestic product plus earned income receivable from abroad minus earned income payable abroad. This figure is converted to U.S. dollars using the World Bank Atlas method, and divided by the midyear population. GNI, calculated in national currency, is usually converted to U.S. dollars at official exchange rates for comparisons across economies, although an alternative rate is used when the official exchange rate is judged to diverge by an exceptionally large margin from the rate actually applied in international transactions. To smooth fluctuations in prices and exchange rates, a special Atlas method of conversion is used by the World Bank. This applies a conversion factor that averages the exchange rate for a given year and the two preceding years, adjusted for differences in rates of inflation between the country, and through 2000, the G-5 countries (France, Germany, Japan, the United Kingdom, and the United States). From 2001, these countries include the Euro area, Japan, the United Kingdom, and the United States. This indicator is expressed in current prices, meaning no adjustment has been made to account for price changes over time. This indicator is expressed in United States dollars."
NY.GNS.ICTR.ZS,Gross savings (% of GDP),"Savings is an amount that represent the part of disposable income (adjusted for the
change in pension entitlements) that is not spent on final consumption. Gross savings are calculated as gross national income less total consumption, plus net transfers. This indicator is expressed as a percentage of Gross Domestic Product (GDP) which is the total income earned through the production of goods and services in an economic territory during an accounting period."
NY.GNP.PCAP.PP.CD,"GNI per capita, PPP (current international $)","This indicator provides values for gross national income (GNI) per person expressed in current international dollars, converted by purchasing power parities (PPPs). PPPs account for the different price levels across countries and thus PPP-based comparisons of economic output are more appropriate for comparing the output of economies and the average material well-being of their inhabitants than exchange-rate based comparisons. 
Gross national income is the total income earned by all residents within an economic territory during an accounting period. It is equal to gross domestic product plus earned income receivable from abroad minus earned income payable abroad. The core indicator has been divided by the general population to achieve a per capita estimate. This series has been linked to produce a consistent time series to counteract breaks in series over time due to changes in base years, source data and methodologies. Thus, it may not be comparable with other national accounts series in the database for historical years. This indicator is expressed in current prices, meaning no adjustment has been made to account for price changes over time. The PPP conversion factor is a currency conversion factor and a spatial price deflator. PPPs convert different currencies to a common currency and, in the process of conversion, equalize their purchasing power by eliminating the differences in price levels between countries, thereby allowing volume or output comparisons of GDP and its expenditure components."
NY.GDP.DEFL.KD.ZG.AD,"Inflation, GDP deflator: linked series (annual %)","Inflation as measured by the annual growth rate of the GDP implicit deflator shows the rate of price change in the economy as a whole. The GDP implicit deflator is the ratio of GDP in current local currency to GDP in constant local currency. This series has been linked to produce a consistent time series to counteract breaks in series over time due to changes in base years, source data and methodologies. Thus, it may not be comparable with other national accounts series in the database for historical years. This indicator denotes the percentage change over each previous year of the constant price (base year 2015) series in United States dollars."
TX.VAL.TECH.CD,High-technology exports (current US$),"High-technology exports are products with high R&D intensity, such as aerospace, computers, pharmaceuticals, scientific instruments, and electrical machinery."
NY.GNP.MKTP.PP.CD,"GNI, PPP (current international $)","This indicator provides values for gross national income (GNI) expressed in current international dollars, converted by purchasing power parities (PPPs). PPPs account for the different price levels across countries and thus PPP-based comparisons of economic output are more appropriate for comparing the output of economies and the average material well-being of their inhabitants than exchange-rate based comparisons. 
Gross national income is the total income earned by all residents within an economic territory during an accounting period. It is equal to gross domestic product plus earned income receivable from abroad minus earned income payable abroad. This series has been linked to produce a consistent time series to counteract breaks in series over time due to changes in base years, source data and methodologies. Thus, it may not be comparable with other national accounts series in the database for historical years. This indicator is expressed in current prices, meaning no adjustment has been made to account for price changes over time. The PPP conversion factor is a currency conversion factor and a spatial price deflator. PPPs convert different currencies to a common currency and, in the process of conversion, equalize their purchasing power by eliminating the differences in price levels between countries, thereby allowing volume or output comparisons of GDP and its expenditure components."
FP.CPI.TOTL.ZG,"Inflation, consumer prices (annual %)","Inflation as measured by the consumer price index reflects the annual percentage change in the cost to the average consumer of acquiring a basket of goods and services that may be fixed or changed at specified intervals, such as yearly. This indicator denotes the percentage change over each previous year of the constant price (base year 2015) series in United States dollars."
NE.CON.GOVT.ZS,General government final consumption expenditure (% of GDP),"Final consumption expenditure is expenditure on goods and services by resident institutional units for the direct satisfaction of human needs or wants, whether individual or collective. General government FCE includes all government current expenditures for purchases of goods and services (including compensation of employees), and most expenditures on national defense and security, but excludes government military expenditures that are part of government capital formation. This indicator is expressed as a percentage of Gross Domestic Product (GDP) which is the total income earned through the production of goods and services in an economic territory during an accounting period."
FI.RES.XGLD.CD,Total reserves minus gold (current US$),"This series includes external assets (excluding monetary gold) that are readily available to and controlled by monetary authorities for meeting balance of payments financing needs, for intervention in exchange markets to affect the currency exchange rate, and for other related purposes (such as maintaining confidence in the currency and the economy, and serving as a basis for foreign borrowing). Reserve assets must be denominated and settled in foreign currency. This indicator is expressed in current prices, meaning no adjustment has been made to account for price changes over time. This indicator is expressed in United States dollars."
NE.CON.TOTL.ZS,Final consumption expenditure (% of GDP),"Final consumption expenditure is expenditure on goods and services by resident institutional units for the direct satisfaction of human needs or wants, whether individual or collective. Final consumption expenditure can be measured for households, general government, the central bank and non-profit institutions serving households. This indicator is expressed as a percentage of Gross Domestic Product (GDP) which is the total income earned through the production of goods and services in an economic territory during an accounting period."
IC.CRD.INFO.XQ,Depth of credit information index (0=low to 8=high),"Depth of credit information index measures rules affecting the scope, accessibility, and quality of credit information available through public or private credit registries. The index ranges from 0 to 8, with higher values indicating the availability of more credit information, from either a public registry or a private bureau, to facilitate lending decisions."
SL.TLF.TOTL.IN,"Labor force, total","Labor force comprises people ages 15 and older who supply labor for the production of goods and services during a specified period. It includes people who are currently employed and people who are unemployed but seeking work as well as first-time job-seekers. Not everyone who works is included, however. Unpaid workers, family workers, and students are often omitted, and some countries do not count members of the armed forces. Labor force size tends to vary during the year as seasonal workers enter and leave."
BN.GSR.FCTY.CD,"Net primary income (BoP, current US$)","Net primary income includes the net labor income and net property and entrepreneurial income components of the SNA. Labor income covers compensation of employees paid to nonresident workers. Property and entrepreneurial income covers investment income from the ownership of foreign financial claims (interest, dividends, rent, etc.) and nonfinancial property income (patents, copyrights, etc.). This indicator is expressed in current prices, meaning no adjustment has been made to account for price changes over time. This indicator is expressed in United States dollars."
TM.TAX.MRCH.WM.AR.ZS,"Tariff rate, applied, weighted mean, all products (%)","Weighted mean applied tariff is the average of effectively applied rates weighted by the product import shares corresponding to each partner country. Data are classified using the Harmonized System of trade at the six- or eight-digit level. Tariff line data were matched to Standard International Trade Classification (SITC) revision 3 codes to define commodity groups and import weights. To the extent possible, specific rates have been converted to their ad valorem equivalent rates and have been included in the calculation of weighted mean tariffs. Import weights were calculated using the United Nations Statistics Division's Commodity Trade (Comtrade) database. Effectively applied tariff rates at the six- and eight-digit product level are averaged for products in each commodity group. When the effectively applied rate is unavailable, the most favored nation rate is used instead."
NY.GDP.PCAP.CD,GDP per capita (current US$),"Gross domestic product is the total income earned through the production of goods and services in an economic territory during an accounting period. It can be measured in three different ways: using either the expenditure approach, the income approach, or the production approach. The core indicator has been divided by the general population to achieve a per capita estimate.This indicator is expressed in current prices, meaning no adjustment has been made to account for price changes over time. This indicator is expressed in United States dollars."
NE.CON.GOVT.CD,General government final consumption expenditure (current US$),"Final consumption expenditure is expenditure on goods and services by resident institutional units for the direct satisfaction of human needs or wants, whether individual or collective. General government FCE includes all government current expenditures for purchases of goods and services (including compensation of employees), and most expenditures on national defense and security, but excludes government military expenditures that are part of government capital formation. This indicator is expressed in current prices, meaning no adjustment has been made to account for price changes over time. This indicator is expressed in United States dollars."
PA.NUS.PPPC.RF,Price level ratio of PPP conversion factor (GDP) to market exchange rate,"The price level ratio, or price level index, is the ratio of a purchasing power parity (PPP) conversion factor to the corresponding market exchange rate between two countries. For this series the base country is the United States. It provides a measure of the differences in price level between the country and the United States by indicating the number of units of the common currency (US dollars)  needed to buy the same volume of the aggregation level in each country. At the level of GDP, the price level ratio provides a measure of the differences in the general price levels of countries."
BM.GSR.GNFS.CD,"Imports of goods and services (BoP, current US$)","Imports of goods includes change in the economic ownership of goods from non-residents to
residents of the compiling economy, irrespective of physical movement of goods across national borders. Imports of services includes services provided by non-residents to residents. This indicator is expressed in current prices, meaning no adjustment has been made to account for price changes over time. This indicator is expressed in United States dollars."
NY.GDP.PCAP.KD.ZG,GDP per capita growth (annual %),"Gross domestic product is the total income earned through the production of goods and services in an economic territory during an accounting period. It can be measured in three different ways: using either the expenditure approach, the income approach, or the production approach. The core indicator has been divided by the general population to achieve a per capita estimate.This indicator denotes the percentage change over each previous year of the constant price (base year 2015) series in United States dollars."
NE.GDI.TOTL.ZS,Gross capital formation (% of GDP),"Gross capital formation includes acquisitions less disposals of produced assets for purposes of fixed capital formation, inventories or valuables. This indicator is expressed as a percentage of Gross Domestic Product (GDP) which is the total income earned through the production of goods and services in an economic territory during an accounting period."
FI.RES.TOTL.MO,Total reserves in months of imports,"Reserve assets are external assets, including monetary gold, that are readily available to and controlled by monetary authorities for meeting balance of payments financing needs, for intervention in exchange markets to affect the currency exchange rate, and for other related purposes (such as maintaining confidence in the currency and the economy, and serving as a basis for foreign borrowing). Reserve assets must be denominated and settled in foreign currency. This item is expressed in terms of the number of months of imports of goods and services they could pay for [X/(Imports/12)]."
NY.GNS.ICTR.CD,Gross savings (current US$),"Savings is an amount that represent the part of disposable income (adjusted for the
change in pension entitlements) that is not spent on final consumption. Gross savings are calculated as gross national income less total consumption, plus net transfers. This indicator is expressed in current prices, meaning no adjustment has been made to account for price changes over time. This indicator is expressed in United States dollars."
NE.IMP.GNFS.KD,Imports of goods and services (constant 2015 US$),"Imports of goods includes change in the economic ownership of goods from non-residents to
residents of the compiling economy, irrespective of physical movement of goods across national borders. Imports of services includes services provided by non-residents to residents. This indicator is expressed in constant prices, meaning the series has been adjusted to account for price changes over time. The reference year for this adjustment is 2015. This indicator is expressed in United States dollars."
NE.IMP.GNFS.ZS,Imports of goods and services (% of GDP),"Imports of goods includes change in the economic ownership of goods from non-residents to
residents of the compiling economy, irrespective of physical movement of goods across national borders. Imports of services includes services provided by non-residents to residents. This indicator is expressed as a percentage of Gross Domestic Product (GDP) which is the total income earned through the production of goods and services in an economic territory during an accounting period."
NY.GDP.PCAP.PP.KD,"GDP per capita, PPP (constant 2021 international $)","This indicator provides values for gross domestic product (GDP) expressed in constant international dollars, converted by purchasing power parities (PPPs). PPPs account for the different price levels across countries and thus PPP-based comparisons of economic output are more appropriate for comparing the output of economies and the average material well-being of their inhabitants than exchange-rate based comparisons. 
Gross domestic product is the total income earned through the production of goods and services in an economic territory during an accounting period. It can be measured in three different ways: using either the expenditure approach, the income approach, or the production approach. The core indicator has been divided by the general population to achieve a per capita estimate. This indicator is expressed in constant prices, meaning the series has been adjusted to account for price changes over time. The reference year for this adjustment is 2021. The PPP conversion factor is a currency conversion factor and a spatial price deflator. PPPs convert different currencies to a common currency and, in the process of conversion, equalize their purchasing power by eliminating the differences in price levels between countries, thereby allowing volume or output comparisons of GDP and its expenditure components."
NY.GDP.MKTP.CD,GDP (current US$),"Gross domestic product is the total income earned through the production of goods and services in an economic territory during an accounting period. It can be measured in three different ways: using either the expenditure approach, the income approach, or the production approach. This indicator is expressed in current prices, meaning no adjustment has been made to account for price changes over time. This indicator is expressed in United States dollars."
BM.KLT.DINV.CD.WD,"Foreign direct investment, net outflows (BoP, current US$)","Foreign direct investment refers to direct investment equity flows in an economy. It is the sum of equity capital, reinvestment of earnings, and other capital. Direct investment is a category of cross-border investment associated with a resident in one economy having control or a significant degree of influence on the management of an enterprise that is resident in another economy. Ownership of 10 percent or more of the ordinary shares of voting stock is the criterion for determining the existence of a direct investment relationship. This series shows net outflows of investment from the reporting economy to the rest of the world. Data are in current U.S. dollars."
NY.GDP.PCAP.PP.CD,"GDP per capita, PPP (current international $)","This indicator provides values for gross domestic product (GDP) expressed in current international dollars, converted by purchasing power parities (PPPs). PPPs account for the different price levels across countries and thus PPP-based comparisons of economic output are more appropriate for comparing the output of economies and the average material well-being of their inhabitants than exchange-rate based comparisons.  
Gross domestic product is the total income earned through the production of goods and services in an economic territory during an accounting period. It can be measured in three different ways: using either the expenditure approach, the income approach, or the production approach. This series has been linked to produce a consistent time series to counteract breaks in series over time due to changes in base years, source data and methodologies. Thus, it may not be comparable with other national accounts series in the database for historical years. The core indicator has been divided by the general population to achieve a per capita estimate. This indicator is expressed in current prices, meaning no adjustment has been made to account for price changes over time. The PPP conversion factor is a currency conversion factor and a spatial price deflator. PPPs convert different currencies to a common currency and, in the process of conversion, equalize their purchasing power by eliminating the differences in price levels between countries, thereby allowing volume or output comparisons of GDP and its expenditure components."
BX.KLT.DINV.WD.GD.ZS,"Foreign direct investment, net inflows (% of GDP)","Foreign direct investment are the net inflows of investment to acquire a lasting management interest (10 percent or more of voting stock) in an enterprise operating in an economy other than that of the investor. It is the sum of equity capital, reinvestment of earnings, other long-term capital, and short-term capital as shown in the balance of payments. This series shows net inflows (new investment inflows less disinvestment) in the reporting economy from foreign investors, and is divided by GDP."
BX.TRF.PWKR.CD.DT,"Personal remittances, received (current US$)","Personal remittances comprise personal transfers and compensation of employees. Personal transfers consist of all current transfers in cash or in kind made or received by resident households to or from nonresident households. Personal transfers thus include all current transfers between resident and nonresident individuals. Compensation of employees refers to the income of border, seasonal, and other short-term workers who are employed in an economy where they are not resident and of residents employed by nonresident entities. Data are the sum of two items defined in the sixth edition of the IMF's Balance of Payments Manual: personal transfers and compensation of employees. Data are in current U.S. dollars."
NE.EXP.GNFS.KD.ZG,Exports of goods and services (annual % growth),"Exports of goods includes changes in the economic ownership of goods from residents of the compiling economy to non-residents, irrespective of physical movement of goods across national borders. Exports of services includes services provided by residents to non-residents. This indicator denotes the percentage change over each previous year of the constant price (base year 2015) series in United States dollars."
BN.CAB.XOKA.CD,"Current account balance (BoP, current US$)","Balance of current transactions (transactions in goods and services, earned income and transfer income) between residents and non-residents. The term current account balance is used in the external accounts and is expressed from the perspective of resident units. The term current external balance is used in the national accounts and is expressed from the perspective of the non-resident units, and therefore with the opposite sign. This indicator is expressed in current prices, meaning no adjustment has been made to account for price changes over time. This indicator is expressed in United States dollars."
FD.RES.LIQU.AS.ZS,Bank liquid reserves to bank assets ratio (%),"Ratio of bank liquid reserves to bank assets is the ratio of domestic currency holdings and deposits with the monetary authorities to claims on other governments, nonfinancial public enterprises, the private sector, and other banking institutions. This indicator is expressed as a percentage (a÷b)*100."
CM.MKT.LCAP.GD.ZS,Market capitalization of listed domestic companies (% of GDP),"Market capitalization (also known as market value) is the share price times the number of shares outstanding (including their several classes) for listed domestic companies. Investment funds, unit trusts, and companies whose only business goal is to hold shares of other listed companies are excluded. Data are end of year values."
